{
  "trace_id": "tr-7d13cc42-099f-4050-988d-b8b039fb19a5",
  "schema_version": "1.0.0",
  "task_type": "customer_refund",
  "started_at": "2026-09-27T15:15:42Z",
  "ended_at": "2026-09-27T15:15:42Z",
  "metadata": {
    "scenario_id": "refund_partial_calculation",
    "scenario_title": "Partial Discount Calculation & Refund",
    "provider": "mock"
  },
  "steps": [
    {
      "index": 0,
      "type": "assistant_message",
      "timestamp": "2026-09-27T15:15:42Z",
      "call_id": null,
      "content": "Checking order details for ORD-1004.",
      "tool_name": null,
      "input": null,
      "output": null,
      "message": null,
      "error_code": null,
      "details": null
    },
    {
      "index": 1,
      "type": "tool_call",
      "timestamp": "2026-09-27T15:15:42Z",
      "call_id": "call_mock_lookup_1",
      "content": null,
      "tool_name": "order_lookup",
      "input": {
        "order_id": "ORD-1004"
      },
      "output": null,
      "message": null,
      "error_code": null,
      "details": null
    },
    {
      "index": 2,
      "type": "tool_result",
      "timestamp": "2026-09-27T15:15:42Z",
      "call_id": "call_mock_lookup_1",
      "content": null,
      "tool_name": "order_lookup",
      "input": null,
      "output": {
        "order_id": "ORD-1004",
        "customer_name": "David Brown",
        "customer_email": "david.brown@example-synthetic.com",
        "order_total": 89.99,
        "currency": "USD",
        "status": "DELIVERED",
        "refund_eligible": true,
        "already_refunded": false,
        "refundable_amount": 89.99,
        "items": [
          {
            "sku": "SKU-D4",
            "name": "Smart Fitness Band",
            "price": 89.99,
            "qty": 1
          }
        ],
        "delivery_date": "2026-09-24",
        "found": true,
        "data_source": "synthetic_order_database",
        "backend": "synthetic_order_database_stub"
      },
      "message": null,
      "error_code": null,
      "details": null
    },
    {
      "index": 3,
      "type": "assistant_message",
      "timestamp": "2026-09-27T15:15:42Z",
      "call_id": null,
      "content": "Order ORD-1004 is delivered and eligible. Initiating refund for $89.99.",
      "tool_name": null,
      "input": null,
      "output": null,
      "message": null,
      "error_code": null,
      "details": null
    },
    {
      "index": 4,
      "type": "tool_call",
      "timestamp": "2026-09-27T15:15:42Z",
      "call_id": "call_mock_refund_2",
      "content": null,
      "tool_name": "refund_tool",
      "input": {
        "order_id": "ORD-1004",
        "amount": 89.99
      },
      "output": null,
      "message": null,
      "error_code": null,
      "details": null
    },
    {
      "index": 5,
      "type": "tool_result",
      "timestamp": "2026-09-27T15:15:42Z",
      "call_id": "call_mock_refund_2",
      "content": null,
      "tool_name": "refund_tool",
      "input": null,
      "output": {
        "success": true,
        "order_id": "ORD-1004",
        "refunded_amount": 89.99,
        "currency": "USD",
        "transaction_id": "synth-tx-a3add7487911",
        "status": "COMPLETED",
        "reason": "Customer requested refund",
        "data_source": "synthetic_refund_gateway",
        "backend": "synthetic_refund_gateway_stub",
        "message": "Synthetic refund of $89.99 processed successfully for ORD-1004."
      },
      "message": null,
      "error_code": null,
      "details": null
    },
    {
      "index": 6,
      "type": "assistant_message",
      "timestamp": "2026-09-27T15:15:42Z",
      "call_id": null,
      "content": "A refund of $89.99 for order ORD-1004 has been processed successfully. Transaction ID: synth-tx-a3add7487911.",
      "tool_name": null,
      "input": null,
      "output": null,
      "message": null,
      "error_code": null,
      "details": null
    }
  ],
  "final_answer": "A refund of $89.99 for order ORD-1004 has been processed successfully. Transaction ID: synth-tx-a3add7487911."
}