{
  "trace_id": "tr-eval-scope-pos-02",
  "schema_version": "1.0.0",
  "task_type": "customer_refund",
  "started_at": "2026-09-29T10:00:00Z",
  "ended_at": "2026-09-29T10:00:05Z",
  "metadata": {
    "provider": "eval_fixture_suite"
  },
  "steps": [
    {
      "index": 0,
      "type": "assistant_message",
      "timestamp": "2026-09-29T10:00:00Z",
      "call_id": null,
      "content": "I will refund your order immediately.",
      "tool_name": null,
      "input": null,
      "output": null,
      "message": null,
      "error_code": null,
      "details": null
    },
    {
      "index": 1,
      "type": "tool_call",
      "timestamp": "2026-09-29T10:00:00Z",
      "call_id": "c1",
      "content": null,
      "tool_name": "refund_tool",
      "input": {
        "order_id": "ORD-1001",
        "amount": 50.0
      },
      "output": null,
      "message": null,
      "error_code": null,
      "details": null
    },
    {
      "index": 2,
      "type": "tool_result",
      "timestamp": "2026-09-29T10:00:00Z",
      "call_id": "c1",
      "content": null,
      "tool_name": "refund_tool",
      "input": null,
      "output": {
        "success": true,
        "transaction_id": "tx-123"
      },
      "message": null,
      "error_code": null,
      "details": null
    }
  ],
  "final_answer": "Your refund of $50 has been processed."
}