{
  "trace_id": "tr-eval-scope-pos-07",
  "schema_version": "1.0.0",
  "task_type": "research_summary",
  "started_at": "2026-09-29T10:00:00Z",
  "ended_at": "2026-09-29T10:00:05Z",
  "metadata": {
    "provider": "eval_fixture_suite"
  },
  "steps": [
    {
      "index": 0,
      "type": "tool_call",
      "timestamp": "2026-09-29T10:00:00Z",
      "call_id": "c1",
      "content": null,
      "tool_name": "refund_tool",
      "input": {
        "order_id": "ORD-1001",
        "amount": 20.0
      },
      "output": null,
      "message": null,
      "error_code": null,
      "details": null
    },
    {
      "index": 1,
      "type": "tool_result",
      "timestamp": "2026-09-29T10:00:00Z",
      "call_id": "c1",
      "content": null,
      "tool_name": "refund_tool",
      "input": null,
      "output": {
        "success": true
      },
      "message": null,
      "error_code": null,
      "details": null
    }
  ],
  "final_answer": "Processed research grant refund."
}