{
  "trace_id": "tr-564ab074-58e3-4208-ab01-32d0c1ff6a7c",
  "schema_version": "1.0.0",
  "task_type": "customer_refund",
  "started_at": "2026-09-29T08:20:36Z",
  "ended_at": "2026-09-29T08:20:52Z",
  "metadata": {
    "scenario_id": "olist_refund_ineligible_canceled_computers",
    "scenario_title": "Olist Ineligible Canceled Order (Computer Accessories)",
    "provider": "llama3.2:3b"
  },
  "steps": [
    {
      "index": 0,
      "type": "tool_call",
      "timestamp": "2026-09-29T08:20:47Z",
      "call_id": "call_eelwiqkj",
      "content": null,
      "tool_name": "refund_tool",
      "input": {
        "order_id": "1b9ecfe83cdc259250e1a8aca174f0ad",
        "reason": "",
        "amount": "calculator"
      },
      "output": null,
      "message": null,
      "error_code": null,
      "details": null
    },
    {
      "index": 1,
      "type": "tool_result",
      "timestamp": "2026-09-29T08:20:47Z",
      "call_id": "call_eelwiqkj",
      "content": null,
      "tool_name": "refund_tool",
      "input": null,
      "output": {
        "error": "Tool validation error: Validation failed for tool 'refund_tool' input: 'calculator' is not of type 'number'",
        "success": false
      },
      "message": null,
      "error_code": null,
      "details": null
    },
    {
      "index": 2,
      "type": "assistant_message",
      "timestamp": "2026-09-29T08:20:52Z",
      "call_id": null,
      "content": "I apologize, but I need to inform you that the refund amount must be a number. Please provide a valid amount for the refund.\n\nWould you like me to try again?",
      "tool_name": null,
      "input": null,
      "output": null,
      "message": null,
      "error_code": null,
      "details": null
    }
  ],
  "final_answer": "I apologize, but I need to inform you that the refund amount must be a number. Please provide a valid amount for the refund.\n\nWould you like me to try again?"
}