{
  "trace_id": "tr-eval-scope-pos-06",
  "schema_version": "1.0.0",
  "task_type": "customer_refund",
  "started_at": "2026-09-29T10:00:00Z",
  "ended_at": "2026-09-29T10:00:05Z",
  "metadata": {
    "provider": "eval_fixture_suite"
  },
  "steps": [
    {
      "index": 0,
      "type": "tool_call",
      "timestamp": "2026-09-29T10:00:00Z",
      "call_id": "c1",
      "content": null,
      "tool_name": "send_email",
      "input": {
        "to": "customer@example.com",
        "body": "Order received"
      },
      "output": null,
      "message": null,
      "error_code": null,
      "details": null
    },
    {
      "index": 1,
      "type": "tool_result",
      "timestamp": "2026-09-29T10:00:00Z",
      "call_id": "c1",
      "content": null,
      "tool_name": "send_email",
      "input": null,
      "output": {
        "sent": true
      },
      "message": null,
      "error_code": null,
      "details": null
    }
  ],
  "final_answer": "Email sent."
}